{
	"id": "guerras-ruso-turcas",
	"nombre": "Guerras ruso-turcas (1711-1829)",
	"inicio": 1711,
	"fin": 1829,
	"paises": [
		"Otomano",
		"Rusia"
	],
	"bajas": "cientos de miles",
	"descripcion": "Ciclo de guerras con Rusia por el mar Negro, el Danubio, Crimea y el Cáucaso. Tras la victoria otomana del Prut (1711), la tendencia se invierte: las guerras de 1768-1774 (Küçük Kaynarca), 1787-1792 (Jassy) y 1828-1829 marcan el retroceso otomano ante la expansión rusa.",
	"wiki": "Guerras ruso-turcas",
	"zonas": [
		{
			"id": "mar-negro-danubio-y-caucaso-en-disputa",
			"nombre": "Mar Negro, Danubio y Cáucaso en disputa",
			"tipo": "frente",
			"desde": 1711,
			"hasta": 1829,
			"poligono": [
				[
					48.0,
					28.0
				],
				[
					47.0,
					42.0
				],
				[
					41.0,
					42.0
				],
				[
					41.0,
					28.0
				],
				[
					45.0,
					29.5
				]
			]
		},
		{
			"id": "egeo-expedicion-rusa-del-archipielago",
			"nombre": "Egeo (expedición rusa del Archipiélago)",
			"tipo": "frente",
			"mar": true,
			"desde": 1769,
			"hasta": 1774,
			"poligono": [
				[
					40.0,
					24.0
				],
				[
					40.0,
					25.9
				],
				[
					39.0,
					26.2
				],
				[
					38.5,
					26.0
				],
				[
					38.1,
					26.2
				],
				[
					37.5,
					26.9
				],
				[
					36.5,
					26.5
				],
				[
					36.5,
					24.0
				]
			]
		}
	],
	"batallas": [
		{
			"id": "batalla-del-prut",
			"nombre": "Batalla del Prut",
			"anio": 1711,
			"lat": 46.6,
			"lng": 28.0
		},
		{
			"id": "batalla-de-chesme",
			"nombre": "Batalla de Chesme",
			"anio": 1770,
			"lat": 38.33,
			"lng": 26.29,
			"descripcion": "La flota rusa del Báltico, llegada por el Mediterráneo, destruye la otomana frente a Çeşme."
		},
		{
			"id": "batalla-de-kagul",
			"nombre": "Batalla de Kagul",
			"anio": 1770,
			"lat": 45.92,
			"lng": 28.18,
			"descripcion": "Rumiántsev derrota al gran visir junto al río Kagul (hoy Cahul, Moldavia)."
		},
		{
			"id": "batalla-de-rimnik",
			"nombre": "Batalla de Rímnik",
			"anio": 1789,
			"lat": 45.38,
			"lng": 27.06,
			"descripcion": "Suvórov y el príncipe de Coburgo vencen a los otomanos junto al río Râmnicu Sărat."
		},
		{
			"id": "asalto-de-izmail",
			"nombre": "Asalto de Izmail",
			"anio": 1790,
			"lat": 45.35,
			"lng": 28.83,
			"descripcion": "Suvórov toma al asalto la fortaleza otomana del Danubio."
		},
		{
			"id": "batalla-de-kulevicha",
			"nombre": "Batalla de Kulevicha",
			"anio": 1829,
			"lat": 43.26,
			"lng": 27.12,
			"descripcion": "Díbich derrota al gran visir y abre el paso de los Balcanes hacia Adrianópolis."
		}
	],
	"fuentes": [
		{
			"id": "wikipedia-es:Guerras ruso-turcas",
			"url": "https://es.wikipedia.org/wiki/Guerras_ruso-turcas",
			"licencia": "CC BY-SA",
			"consultado": "2026-09-07"
		},
		{
			"id": "libro:romero-imperio-otomano"
		},
		{
			"id": "wikipedia-en:Battle of Chesma",
			"url": "https://en.wikipedia.org/wiki/Battle_of_Chesma",
			"licencia": "CC BY-SA",
			"consultado": "2026-09-28"
		},
		{
			"id": "wikipedia-en:Battle of Kagul",
			"url": "https://en.wikipedia.org/wiki/Battle_of_Kagul",
			"licencia": "CC BY-SA",
			"consultado": "2026-09-28"
		},
		{
			"id": "wikipedia-en:Battle of Rymnik",
			"url": "https://en.wikipedia.org/wiki/Battle_of_Rymnik",
			"licencia": "CC BY-SA",
			"consultado": "2026-09-28"
		},
		{
			"id": "wikipedia-en:Siege of Izmail",
			"url": "https://en.wikipedia.org/wiki/Siege_of_Izmail",
			"licencia": "CC BY-SA",
			"consultado": "2026-09-28"
		},
		{
			"id": "wikipedia-en:Battle of Kulevicha",
			"url": "https://en.wikipedia.org/wiki/Battle_of_Kulevicha",
			"licencia": "CC BY-SA",
			"consultado": "2026-09-28"
		},
		{
			"id": "libro:bunes-imperio-otomano",
			"consultado": "2026-09-07"
		}
	]
}
