{
	"id": "guerra-malvinas",
	"nombre": "Guerra de las Malvinas",
	"inicio": 1982,
	"fin": 1982,
	"paises": [
		"Argentina",
		"Reino Unido"
	],
	"bajas": "907 muertos (649 argentinos, 255 británicos, 3 isleños)",
	"descripcion": "El 2 de abril de 1982 la dictadura militar argentina desembarca en las islas Malvinas, bajo administración británica. El Reino Unido envía una fuerza expedicionaria al Atlántico Sur; tras el hundimiento del crucero General Belgrano y una campaña terrestre de diez semanas, las tropas argentinas se rinden en Puerto Argentino (Stanley) el 14 de junio. La derrota precipita la caída de la Junta militar.",
	"wiki": "Guerra de las Malvinas",
	"zonas": [
		{
			"id": "islas-malvinas-ocupacion-y-reconquista",
			"nombre": "Islas Malvinas (ocupación y reconquista)",
			"tipo": "ocupado",
			"desde": 1982,
			"hasta": 1982,
			"poligono": [
				[
					-51.0,
					-61.3
				],
				[
					-51.0,
					-57.7
				],
				[
					-52.4,
					-57.7
				],
				[
					-52.4,
					-61.3
				]
			]
		},
		{
			"id": "zona-de-exclusion-del-atlantico-sur",
			"nombre": "Zona de exclusión del Atlántico Sur",
			"tipo": "frente",
			"desde": 1982,
			"hasta": 1982,
			"poligono": [
				[
					-50.0,
					-63.0
				],
				[
					-50.0,
					-56.0
				],
				[
					-56.0,
					-56.0
				],
				[
					-56.0,
					-63.0
				]
			]
		}
	],
	"batallas": [
		{
			"id": "batalla-de-pradera-del-ganso-goose-green",
			"nombre": "Batalla de Pradera del Ganso (Goose Green)",
			"anio": 1982,
			"lat": -51.82,
			"lng": -58.97
		},
		{
			"id": "batalla-de-san-carlos",
			"nombre": "Batalla de San Carlos",
			"anio": 1982,
			"lat": -51.51,
			"lng": -59.08
		},
		{
			"id": "batalla-del-monte-longdon",
			"nombre": "Batalla del Monte Longdon",
			"anio": 1982,
			"lat": -51.68,
			"lng": -58.0
		},
		{
			"id": "hundimiento-del-ara-general-belgrano",
			"nombre": "Hundimiento del ARA General Belgrano",
			"anio": 1982,
			"lat": -55.4,
			"lng": -61.5
		},
		{
			"id": "hundimiento-del-hms-sheffield",
			"nombre": "Hundimiento del HMS Sheffield",
			"anio": 1982,
			"lat": -53.07,
			"lng": -56.93
		},
		{
			"id": "rendicion-en-puerto-argentino-stanley",
			"nombre": "Rendición en Puerto Argentino (Stanley)",
			"anio": 1982,
			"lat": -51.69,
			"lng": -57.85
		}
	],
	"fuentes": [
		{
			"id": "wikipedia-es:Guerra de las Malvinas",
			"url": "https://es.wikipedia.org/wiki/Guerra_de_las_Malvinas",
			"licencia": "CC BY-SA",
			"consultado": "2026-09-07"
		},
		{
			"id": "wikidata:Q68972231",
			"url": "https://www.wikidata.org/wiki/Q68972231",
			"licencia": "CC0",
			"consultado": "2026-09-09"
		},
		{
			"id": "wikidata:Q4872265",
			"url": "https://www.wikidata.org/wiki/Q4872265",
			"licencia": "CC0",
			"consultado": "2026-09-09"
		},
		{
			"id": "wikidata:Q59559767",
			"url": "https://www.wikidata.org/wiki/Q59559767",
			"licencia": "CC0",
			"consultado": "2026-09-09"
		}
	]
}
