{
	"id": "incidente-manchuria",
	"nombre": "Incidente de Manchuria",
	"inicio": 1931,
	"fin": 1932,
	"paises": [
		"Imperio del Japón (Ejército de Kwantung)",
		"China"
	],
	"bajas": "miles",
	"descripcion": "El Ejército de Kwantung fabrica el sabotaje de Mukden y ocupa toda Manchuria, creando el estado títere de Manchukuo y precipitando la salida de Japón de la Sociedad de Naciones.",
	"wiki": "Incidente de Mukden",
	"zonas": [
		{
			"id": "manchuria-ocupada",
			"nombre": "Manchuria ocupada",
			"tipo": "ocupado",
			"desde": 1931,
			"hasta": 1932,
			"poligono": [
				[
					49.0,
					120.0
				],
				[
					49.0,
					131.0
				],
				[
					40.0,
					124.5
				],
				[
					42.0,
					119.8
				]
			]
		}
	],
	"batallas": [
		{
			"id": "incidente-de-mukden",
			"nombre": "Incidente de Mukden",
			"anio": 1931,
			"lat": 41.8,
			"lng": 123.43,
			"descripcion": "Explosión provocada en el ferrocarril que sirve de pretexto a la invasión."
		}
	],
	"fuentes": [
		{
			"id": "wikipedia-es:Incidente de Mukden",
			"url": "https://es.wikipedia.org/wiki/Incidente_de_Mukden",
			"licencia": "CC BY-SA",
			"consultado": "2026-09-07"
		}
	]
}
