{
	"id": "cienanos",
	"nombre": "Guerra de los Cien Años",
	"inicio": 1337,
	"fin": 1453,
	"paises": [
		"Francia",
		"Inglaterra",
		"Borgoña"
	],
	"bajas": "~2.000.000-3.000.000 de muertos",
	"descripcion": "Larga pugna dinástica por la corona de Francia.",
	"wiki": "Guerra de los Cien Años",
	"zonas": [
		{
			"id": "guyena-y-suroeste",
			"nombre": "Guyena y suroeste",
			"tipo": "frente",
			"desde": 1337,
			"hasta": 1360,
			"poligono": [
				[
					46,
					-1.2
				],
				[
					45.8,
					1.5
				],
				[
					43.5,
					1.5
				],
				[
					43.3,
					-1.5
				]
			]
		},
		{
			"id": "campanas-de-crecy-y-poitiers",
			"nombre": "Campañas de Crécy y Poitiers",
			"tipo": "frente",
			"desde": 1345,
			"hasta": 1360,
			"poligono": [
				[
					50.8,
					0.5
				],
				[
					50.3,
					3.5
				],
				[
					48.5,
					3
				],
				[
					46.5,
					0.8
				],
				[
					48.5,
					-1.5
				]
			]
		},
		{
			"id": "francia-anglo-borgonona",
			"nombre": "Francia anglo-borgoñona",
			"tipo": "ocupado",
			"desde": 1420,
			"hasta": 1436,
			"poligono": [
				[
					51,
					1.8
				],
				[
					50.5,
					4.5
				],
				[
					48,
					5
				],
				[
					47,
					2.5
				],
				[
					48.3,
					-0.5
				],
				[
					49.8,
					0
				]
			]
		},
		{
			"id": "campanas-de-enrique-v-y-juana-de-arco",
			"nombre": "Campañas de Enrique V y Juana de Arco",
			"tipo": "frente",
			"desde": 1415,
			"hasta": 1436,
			"poligono": [
				[
					49.7,
					-0.5
				],
				[
					49.5,
					4
				],
				[
					47.5,
					4.5
				],
				[
					47.3,
					0.5
				],
				[
					48.8,
					-1
				]
			]
		},
		{
			"id": "reconquista-francesa",
			"nombre": "Reconquista francesa",
			"tipo": "frente",
			"desde": 1436,
			"hasta": 1453,
			"poligono": [
				[
					49.8,
					-1.8
				],
				[
					49.5,
					1.5
				],
				[
					48.5,
					0.5
				],
				[
					46,
					0
				],
				[
					44.8,
					0.5
				],
				[
					43.8,
					-0.5
				],
				[
					45.5,
					-1.2
				],
				[
					48.5,
					-2
				]
			]
		},
		{
			"id": "flandes-y-el-canal",
			"nombre": "Flandes y el Canal",
			"tipo": "frente",
			"mar": true,
			"desde": 1340,
			"hasta": 1340,
			"poligono": [
				[
					51.6,
					2.8
				],
				[
					51.6,
					3.9
				],
				[
					51.1,
					3.9
				],
				[
					51.1,
					2.8
				]
			]
		}
	],
	"batallas": [
		{
			"id": "batalla-de-arnemuiden",
			"nombre": "Batalla de Arnemuiden",
			"anio": 1338,
			"lat": 51.65,
			"lng": 3.37
		},
		{
			"id": "batalla-naval-de-la-esclusa-sluys",
			"nombre": "Batalla naval de La Esclusa (Sluys)",
			"anio": 1340,
			"lat": 51.35,
			"lng": 3.375,
			"descripcion": "La flota de Eduardo III destruye la francesa frente a Sluys (24 de junio de 1340).",
			"bajas": "16.000-20.000 muertos franceses",
			"wiki": "Batalla de La Esclusa"
		},
		{
			"id": "batalla-de-crecy",
			"nombre": "Batalla de Crécy",
			"anio": 1346,
			"lat": 50.25,
			"lng": 1.88,
			"descripcion": "Los arqueros ingleses aplastan a la caballería francesa.",
			"bajas": "~4.000 franceses muertos"
		},
		{
			"id": "batalla-de-lunalonge",
			"nombre": "Batalla de Lunalonge",
			"anio": 1349,
			"lat": 46.13,
			"lng": 0.17
		},
		{
			"id": "batalla-de-winchelsea",
			"nombre": "Batalla de Winchelsea",
			"anio": 1350,
			"lat": 50.88,
			"lng": 0.81
		},
		{
			"id": "batalla-de-ardres",
			"nombre": "Batalla de Ardres",
			"anio": 1351,
			"lat": 50.86,
			"lng": 1.98
		},
		{
			"id": "batalla-de-vlaardingen",
			"nombre": "Batalla de Vlaardingen",
			"anio": 1351,
			"lat": 51.91,
			"lng": 4.34
		},
		{
			"id": "batalla-de-poitiers",
			"nombre": "Batalla de Poitiers",
			"anio": 1356,
			"lat": 46.52,
			"lng": 0.4
		},
		{
			"id": "batalla-de-najera",
			"nombre": "Batalla de Nájera",
			"anio": 1367,
			"lat": 42.43,
			"lng": -2.7
		},
		{
			"id": "batalla-de-la-rochelle",
			"nombre": "Batalla de La Rochelle",
			"anio": 1372,
			"lat": 46.17,
			"lng": -1.15
		},
		{
			"id": "batalla-de-azincourt",
			"nombre": "Batalla de Azincourt",
			"anio": 1415,
			"lat": 50.46,
			"lng": 2.14,
			"descripcion": "Enrique V vence pese a la enorme inferioridad numérica.",
			"bajas": "~6.000 franceses muertos"
		},
		{
			"id": "batalla-de-chef-de-caux",
			"nombre": "Batalla de Chef-de-Caux",
			"anio": 1416,
			"lat": 49.51,
			"lng": 0.08
		},
		{
			"id": "sitio-de-bayeux-1417",
			"nombre": "Sitio de Bayeux (1417)",
			"anio": 1417,
			"lat": 49.28,
			"lng": -0.7
		},
		{
			"id": "batalla-de-la-rochelle-1419",
			"nombre": "Batalla de La Rochelle (1419)",
			"anio": 1419,
			"lat": 46.15,
			"lng": -1.2
		},
		{
			"id": "batalla-de-bauge",
			"nombre": "Batalla de Baugé",
			"anio": 1421,
			"lat": 47.54,
			"lng": -0.1
		},
		{
			"id": "batalla-de-la-brossiniere",
			"nombre": "Batalla de La Brossinière",
			"anio": 1423,
			"lat": 47.77,
			"lng": -0.74
		},
		{
			"id": "batalla-de-verneuil",
			"nombre": "Batalla de Verneuil",
			"anio": 1424,
			"lat": 48.76,
			"lng": 0.94
		},
		{
			"id": "liberacion-de-orleans",
			"nombre": "Liberación de Orleans",
			"anio": 1429,
			"lat": 47.9,
			"lng": 1.9,
			"descripcion": "Juana de Arco levanta el sitio y cambia el curso de la guerra."
		},
		{
			"id": "batalla-de-castillon",
			"nombre": "Batalla de Castillon",
			"anio": 1453,
			"lat": 44.85,
			"lng": -0.04,
			"descripcion": "Última batalla: la artillería francesa expulsa a Inglaterra del continente."
		}
	],
	"fuentes": [
		{
			"id": "wikipedia-es:Guerra de los Cien Años",
			"url": "https://es.wikipedia.org/wiki/Guerra_de_los_Cien_Años",
			"licencia": "CC BY-SA"
		},
		{
			"id": "curado",
			"licencia": "elaboración propia contrastada con Wikipedia"
		},
		{
			"id": "wikidata:Q48760695",
			"url": "https://www.wikidata.org/wiki/Q48760695",
			"licencia": "CC0",
			"consultado": "2026-09-02"
		},
		{
			"id": "wikidata:Q1631158",
			"url": "https://www.wikidata.org/wiki/Q1631158",
			"licencia": "CC0",
			"consultado": "2026-09-02"
		},
		{
			"id": "wikidata:Q13126306",
			"url": "https://www.wikidata.org/wiki/Q13126306",
			"licencia": "CC0",
			"consultado": "2026-09-02"
		},
		{
			"id": "wikidata:Q1785755",
			"url": "https://www.wikidata.org/wiki/Q1785755",
			"licencia": "CC0",
			"consultado": "2026-09-02"
		},
		{
			"id": "wikidata:Q4872613",
			"url": "https://www.wikidata.org/wiki/Q4872613",
			"licencia": "CC0",
			"consultado": "2026-09-02"
		},
		{
			"id": "wikidata:Q4871831",
			"url": "https://www.wikidata.org/wiki/Q4871831",
			"licencia": "CC0",
			"consultado": "2026-09-02"
		},
		{
			"id": "wikidata:Q14360474",
			"url": "https://www.wikidata.org/wiki/Q14360474",
			"licencia": "CC0",
			"consultado": "2026-09-02"
		},
		{
			"id": "wikidata:Q3406467",
			"url": "https://www.wikidata.org/wiki/Q3406467",
			"licencia": "CC0",
			"consultado": "2026-09-02"
		},
		{
			"id": "wikidata:Q2889732",
			"url": "https://www.wikidata.org/wiki/Q2889732",
			"licencia": "CC0",
			"consultado": "2026-09-02"
		},
		{
			"id": "wikidata:Q13126315",
			"url": "https://www.wikidata.org/wiki/Q13126315",
			"licencia": "CC0",
			"consultado": "2026-09-02"
		},
		{
			"id": "wikidata:Q201692",
			"url": "https://www.wikidata.org/wiki/Q201692",
			"licencia": "CC0",
			"consultado": "2026-09-02"
		},
		{
			"id": "wikidata:Q2139756",
			"url": "https://www.wikidata.org/wiki/Q2139756",
			"licencia": "CC0",
			"consultado": "2026-09-02"
		},
		{
			"id": "wikidata:Q4872432",
			"url": "https://www.wikidata.org/wiki/Q4872432",
			"licencia": "CC0",
			"consultado": "2026-09-02"
		},
		{
			"id": "wikidata:Q2887879",
			"url": "https://www.wikidata.org/wiki/Q2887879",
			"licencia": "CC0",
			"consultado": "2026-09-02"
		},
		{
			"id": "wikidata:Q166961",
			"url": "https://www.wikidata.org/wiki/Q166961",
			"licencia": "CC0",
			"consultado": "2026-09-02"
		},
		{
			"id": "wikidata:Q4871615",
			"url": "https://www.wikidata.org/wiki/Q4871615",
			"licencia": "CC0",
			"consultado": "2026-09-02"
		},
		{
			"id": "wikidata:Q911131",
			"url": "https://www.wikidata.org/wiki/Q911131",
			"licencia": "CC0",
			"consultado": "2026-09-02"
		},
		{
			"id": "wikidata:Q425617",
			"url": "https://www.wikidata.org/wiki/Q425617",
			"licencia": "CC0",
			"consultado": "2026-09-02"
		},
		{
			"id": "wikidata:Q518005",
			"url": "https://www.wikidata.org/wiki/Q518005",
			"licencia": "CC0",
			"consultado": "2026-09-02"
		},
		{
			"id": "wikidata:Q4871519",
			"url": "https://www.wikidata.org/wiki/Q4871519",
			"licencia": "CC0",
			"consultado": "2026-09-02"
		},
		{
			"id": "wikidata:Q135587644",
			"url": "https://www.wikidata.org/wiki/Q135587644",
			"licencia": "CC0",
			"consultado": "2026-09-02"
		},
		{
			"id": "wikidata:Q1985934",
			"url": "https://www.wikidata.org/wiki/Q1985934",
			"licencia": "CC0",
			"consultado": "2026-09-02"
		},
		{
			"id": "wikidata:Q1523324",
			"url": "https://www.wikidata.org/wiki/Q1523324",
			"licencia": "CC0",
			"consultado": "2026-09-02"
		},
		{
			"id": "wikipedia-en:Battle of Radcot Bridge",
			"url": "https://en.wikipedia.org/wiki/Battle_of_Radcot_Bridge",
			"licencia": "CC BY-SA",
			"consultado": "2026-09-28"
		},
		{
			"id": "wikipedia-en:Battle of Sluys",
			"url": "https://en.wikipedia.org/wiki/Battle_of_Sluys",
			"licencia": "CC BY-SA",
			"consultado": "2026-09-28"
		}
	]
}
