{
	"id": "guerras-siriacas",
	"nombre": "Guerras Siriacas",
	"inicio": -274,
	"fin": -168,
	"paises": [
		"Egipto ptolemaico",
		"Reino seléucida"
	],
	"bajas": "decenas de miles",
	"descripcion": "Serie de guerras entre lágidas y seléucidas por el control de Celesiria, Fenicia y el Egeo oriental. La victoria ptolemaica en Rafia (217) y, sobre todo, la seléucida en Panion (200) desplazaron el dominio de la región hacia Antioquía, hasta que Roma frenó a Antíoco IV en el 168.",
	"wiki": "Guerras Sirias",
	"zonas": [
		{
			"id": "celesiria-y-fenicia-frente-terrestre",
			"nombre": "Celesiria y Fenicia (frente terrestre)",
			"tipo": "frente",
			"desde": -274,
			"hasta": -168,
			"poligono": [
				[
					36.2,
					36.2
				],
				[
					35.0,
					36.6
				],
				[
					31.3,
					34.3
				],
				[
					31.9,
					35.0
				],
				[
					34.5,
					36.0
				]
			]
		},
		{
			"id": "egeo-oriental-y-costa-de-anatolia",
			"nombre": "Egeo oriental y costa de Anatolia",
			"tipo": "frente",
			"desde": -274,
			"hasta": -168,
			"poligono": [
				[
					39.1,
					26.6
				],
				[
					38.0,
					27.5
				],
				[
					36.7,
					28.5
				],
				[
					37.5,
					26.6
				]
			]
		}
	],
	"batallas": [
		{
			"id": "rafia",
			"nombre": "Rafia",
			"anio": -217,
			"lat": 31.29,
			"lng": 34.25
		},
		{
			"id": "panion",
			"nombre": "Panion",
			"anio": -200,
			"lat": 33.25,
			"lng": 35.69
		}
	],
	"fuentes": [
		{
			"id": "wikipedia-es:Guerras Sirias",
			"url": "https://es.wikipedia.org/wiki/Guerras_Sirias",
			"licencia": "CC BY-SA",
			"consultado": "2026-09-07"
		}
	]
}
