{
	"id": "reconquista",
	"nombre": "La Reconquista",
	"inicio": 722,
	"fin": 1492,
	"paises": [
		"Reino de Asturias",
		"Reino de León",
		"Corona de Castilla",
		"Corona de Aragón",
		"Reino de Navarra",
		"Portugal",
		"Califato de Córdoba",
		"Almorávides",
		"Califato almohade",
		"Reino nazarí de Granada"
	],
	"bajas": "desconocidas: siete siglos de guerra de frontera",
	"descripcion": "Siete siglos y medio de avance cristiano de norte a sur de la península, de Covadonga (722) a Granada (1492), con largos periodos de convivencia y frontera entre medias.",
	"wiki": "Reconquista",
	"zonas": [
		{
			"id": "frontera-del-duero",
			"nombre": "Frontera del Duero",
			"tipo": "frente",
			"desde": 722,
			"hasta": 1000,
			"poligono": [
				[
					43.2,
					-8
				],
				[
					43,
					-2
				],
				[
					41.5,
					-2.5
				],
				[
					41.3,
					-8.3
				]
			]
		},
		{
			"id": "frontera-del-tajo-al-guadalquivir",
			"nombre": "Frontera del Tajo al Guadalquivir",
			"tipo": "frente",
			"desde": 1000,
			"hasta": 1250,
			"poligono": [
				[
					40.5,
					-6.5
				],
				[
					40.2,
					-1
				],
				[
					37.5,
					-1.5
				],
				[
					37,
					-6.5
				],
				[
					39,
					-7.2
				]
			]
		},
		{
			"id": "frontera-de-granada",
			"nombre": "Frontera de Granada",
			"tipo": "frente",
			"desde": 1250,
			"hasta": 1492,
			"poligono": [
				[
					38.3,
					-6
				],
				[
					38,
					-1.8
				],
				[
					36.6,
					-2
				],
				[
					36.2,
					-5.5
				],
				[
					37.3,
					-6.3
				]
			]
		}
	],
	"batallas": [
		{
			"id": "batalla-de-clavijo-legendaria",
			"nombre": "Batalla de Clavijo (legendaria)",
			"anio": 844,
			"lat": 42.25,
			"lng": -2.36,
			"descripcion": "Victoria legendaria de Ramiro I de Asturias, origen del mito de Santiago Matamoros (historicidad discutida).",
			"wiki": "Batalla de Clavijo"
		},
		{
			"id": "batalla-de-simancas",
			"nombre": "Batalla de Simancas",
			"anio": 939,
			"lat": 41.59,
			"lng": -4.83,
			"descripcion": "Ramiro II de León derrota a Abderramán III."
		},
		{
			"id": "batalla-de-calatanazor",
			"nombre": "Batalla de Calatañazor",
			"anio": 1002,
			"lat": 41.6,
			"lng": -2.83,
			"descripcion": "Según la tradición, primera gran derrota de Almanzor poco antes de su muerte («En Calatañazor perdió Almanzor el tambor»).",
			"wiki": "Batalla de Calatañazor"
		},
		{
			"id": "batalla-de-golpejera",
			"nombre": "Batalla de Golpejera",
			"anio": 1072,
			"lat": 42.24,
			"lng": -4.66
		},
		{
			"id": "toma-de-toledo",
			"nombre": "Toma de Toledo",
			"anio": 1085,
			"lat": 39.86,
			"lng": -4.03,
			"descripcion": "Alfonso VI conquista la antigua capital visigoda; la frontera salta al Tajo."
		},
		{
			"id": "batalla-de-sagrajas-zalaca",
			"nombre": "Batalla de Sagrajas (Zalaca)",
			"anio": 1086,
			"lat": 38.93,
			"lng": -6.94,
			"descripcion": "Los almorávides aplastan a Alfonso VI y frenan el avance cristiano."
		},
		{
			"id": "batalla-de-almodovar-del-rio",
			"nombre": "Batalla de Almodóvar del Río",
			"anio": 1091,
			"lat": 37.8,
			"lng": -5.02
		},
		{
			"id": "conquista-de-valencia-el-cid",
			"nombre": "Conquista de Valencia (el Cid)",
			"anio": 1094,
			"lat": 39.47,
			"lng": -0.38,
			"descripcion": "Rodrigo Díaz de Vivar toma la ciudad, que perderá su viuda en 1102."
		},
		{
			"id": "batalla-de-bairen",
			"nombre": "Batalla de Bairén",
			"anio": 1097,
			"lat": 39.0,
			"lng": -0.26
		},
		{
			"id": "batalla-de-ucles",
			"nombre": "Batalla de Uclés",
			"anio": 1108,
			"lat": 39.98,
			"lng": -2.86,
			"descripcion": "Desastre castellano; muere el heredero Sancho Alfónsez."
		},
		{
			"id": "batalla-de-montiel-1143",
			"nombre": "Batalla de Montiel (1143)",
			"anio": 1143,
			"lat": 39.0,
			"lng": -4.0
		},
		{
			"id": "conquista-de-lisboa-1147",
			"nombre": "Conquista de Lisboa (1147)",
			"anio": 1147,
			"lat": 38.71,
			"lng": -9.13,
			"descripcion": "Alfonso I Enríquez toma la ciudad con ayuda de los cruzados de la Segunda Cruzada (1 de julio - 25 de octubre de 1147); Alfonso VI la había ocupado brevemente en 1093-1094."
		},
		{
			"id": "batalla-de-calatrava",
			"nombre": "Batalla de Calatrava",
			"anio": 1173,
			"lat": 38.85,
			"lng": -4.07
		},
		{
			"id": "batalla-del-campo-de-monteagudo",
			"nombre": "Batalla del Campo de Monteagudo",
			"anio": 1190,
			"lat": 40.44,
			"lng": -0.85
		},
		{
			"id": "batalla-de-alarcos",
			"nombre": "Batalla de Alarcos",
			"anio": 1195,
			"lat": 38.95,
			"lng": -4.01,
			"descripcion": "La gran victoria almohade que precede a Las Navas.",
			"bajas": "~20.000 bajas castellanas según las crónicas"
		},
		{
			"id": "conquista-de-sevilla",
			"nombre": "Conquista de Sevilla",
			"anio": 1248,
			"lat": 37.39,
			"lng": -5.99,
			"descripcion": "Fernando III toma la mayor ciudad de al-Ándalus tras dos años de asedio."
		},
		{
			"id": "batalla-del-salado",
			"nombre": "Batalla del Salado",
			"anio": 1340,
			"lat": 36.18,
			"lng": -5.71,
			"descripcion": "Castilla y Portugal derrotan al último gran ejército invasor norteafricano."
		}
	],
	"fuentes": [
		{
			"id": "wikipedia-es:Reconquista",
			"url": "https://es.wikipedia.org/wiki/Reconquista",
			"licencia": "CC BY-SA"
		},
		{
			"id": "curado",
			"licencia": "elaboración propia contrastada con Wikipedia"
		},
		{
			"id": "wikidata:Q1243260",
			"url": "https://www.wikidata.org/wiki/Q1243260",
			"licencia": "CC0",
			"consultado": "2026-09-02"
		},
		{
			"id": "wikidata:Q130251286",
			"url": "https://www.wikidata.org/wiki/Q130251286",
			"licencia": "CC0",
			"consultado": "2026-09-02"
		},
		{
			"id": "wikidata:Q131686617",
			"url": "https://www.wikidata.org/wiki/Q131686617",
			"licencia": "CC0",
			"consultado": "2026-09-02"
		},
		{
			"id": "wikidata:Q4871780",
			"url": "https://www.wikidata.org/wiki/Q4871780",
			"licencia": "CC0",
			"consultado": "2026-09-02"
		},
		{
			"id": "wikidata:Q2888093",
			"url": "https://www.wikidata.org/wiki/Q2888093",
			"licencia": "CC0",
			"consultado": "2026-09-02"
		},
		{
			"id": "wikidata:Q131542395",
			"url": "https://www.wikidata.org/wiki/Q131542395",
			"licencia": "CC0",
			"consultado": "2026-09-02"
		},
		{
			"id": "wikidata:Q20616054",
			"url": "https://www.wikidata.org/wiki/Q20616054",
			"licencia": "CC0",
			"consultado": "2026-09-02"
		},
		{
			"id": "wikipedia-es:Batalla de Clavijo",
			"url": "https://es.wikipedia.org/wiki/Batalla_de_Clavijo",
			"licencia": "CC BY-SA",
			"consultado": "2026-09-28"
		}
	]
}
